text,label
i feel i had to take some artistic license on it in a way because there wasn t enough i knew about her,1
i feel less aggravated dealing with gg and you well some of you lucky wenches know how i feel about that show,3
i still use the gatsby facial paper when i m feeling really hot and sticky because it really cools down your face and gets rid of dirt and stuff,2
i feel discouraged and sad that i don t have the get up and go of a normal person,0
i cant help but feel beloved is trying to get some sort of revenge on sethe,2
i hope your generation doesn t feel as neurotic as we did,4
i didn t feel dangerous but i knew it would probably be a challenge,3
i feel the vegetables are just as confused as we are she said a,4
i feel the inner mad scientist lurking nearby,3
i get my feelings hurt over something as ridiculous as that,0
i love using rose hip oil to help with the production of oil on my face and leave my skin feeling super soft,1
i feel tortured to cont i stop,3
i umenyiora feels disrespected e mail a rel nofollow class tipsytext style positionrelative toppx leftpx title more options target blank href http www,0
i feel relaxed that i can make more and i feel worthy of charging good money for what i do and actually i m about to raise my prices again,1
i always come away from feel positive,1
i think you feel sad,0
i like ani difranco or jay z but feel slightly strange because i know the music isnt for me,4
i feel like mirai did not get enough credit in the us as compared to rachel flatts who ive not been impressed by,5
i just hope she doesnt feel spiteful that several little preschool friends have had big year old parties,3
i feel very melancholy about it,0
i feel empty right now but i have this weird feeling that i am floating and i cant feel my feet,0
i feel energetic and just great overall,1
i cant keep going on feeling like this or it might become dangerous,3
i feel and shes not caring enough yet im going to tell my head doctor aka her boss that i dont want to see her again she kept judging me and stuff i just didnt like her,2
i need to work on increasing my self worth because if these boys knew how much i linger on them mentally they would probabley feel a little disturbed if not totally overwhelmed knowing i am feeling this intense,0
i already feel like i need to watch over her gt gt covers hate comments from innocent eyes,1
i feel things are back to where it was you being angry at me and all,3
i feel like i should add some charming witticisms or details from my day but i dont know that i have the brain strength to do so,1
i am going to print this and refer to it as often as i can so that when i feel things which arent so pleasant i can remember that now is the only moment i have to live in so make the most of it,1
i watch another couple break up another romantic fall apart he pales obsoletes fades away tries to run tries to hurt and i feel like the only faithful person left,1
i feel that her observation with men having to learn to expect to be rejected by women is something that i think is kinda of correct,0
im feeling annoyed by every little thing because im not getting what i want,3
im getting pretty good at pretending to be okay so someone else falling apart can leave me feeling taken aback and unsure of myself,4
i feel i am doomed to be fucking sad forever,0
i always feel proud of myself when i go on a long bike ride by myself with all kids,1
i feel fully welcomed to azerbaijan and can t wait for my experiences to come,1
i am not able to show that directly and so i feel suffocated and irritated,3
i do not want an unfeeling wax doll constantly before me although i likewise cannot grasp what makes you so terrified hellip,4
i doesnt even feel so very frightened as she watches the dot inch down just closes her eyes and waits for the end to come,4
im so used to work that it feels weird to be at home right now not working,5
i feel graceful and free in the water,1
i feel intelligent because i made it here,1
i feel contented with the progress that i have made each day,1
ill miss nuvias fantastic cooking and the families fine hospitality i feel a little relieved,1
i feel thankful to my heavenly father,1
i feel intimidated by them and their developing brains and bodies,4
i feel so honoured to be part of this most extraordinary adventure,1
i didnt feel regretful of the exertion afterward,0
i feel jolly waking up this morning i feel jolly waking up this morning th november by ladyyjae,1
i feel radiant this morning,1
i feel so lucky to have been a little kid during the s,1
i feel and see her if i dont tell her the sincere talk and i think that i will be by myself suppressed the crazy,1
i feel kinda stupid for admitting this a few weeks ago i finally figured out what the macro setting was on my camera and how to use it,0
i have a feeling he s going to get probation and mandated supportive living,2
i feel like someone waking from a long and disturbed sleep,0
i love the rain but right now it is making me feel kinda gloomy,0
i feel lucky index for useless websites here s the i feel lucky index for useless websites a href http www,1
i honestly cannot remember but what i do remember is feeling terrified that an experience we had not shared at all even after dating and being inseparable for slightly over one year could occur so immediately,4
i feel like i ve been robbed of something vital,1
i certainly feel accepted more readily but i struggle to get comfortable in groups of other mothers thanks to years of always feeling like the outcast,1
i feel like im on an emotional roller coaster,0
i knew then how i d feel for the rest of the day groggy foggy trance like numb straight faced no smiles no laughs,0
i feel are simply intellectually curious enough to wonder what might happen when a man simply stops washing his hair,5
i feel really smart for being able to acknowledge this,1
i feel like ive been so greedy and useless buying things and then not fitting i also won a pair of earrings on ebay which turned out to be minute,3
i feel the demon of depression coming on an unwelcome visitor that wants to take permanent residence in my home,0
i left the party feeling energized recommitted and pleased with how it had turned out,1
i know in my head that my worth as a person doesnt come from what i do but my heart is constantly seeking something to make me feel worthwhile,1
im feeling deeply overwhelmed by these ordinary tasks,4
i don t always feel funny,5
i start to feel ugly pale my humanity diminished,0
i feel so rich inside,1
i am really having withdrawal symptoms from my friends at uni so i am feeling eager to do some uni work over the remainder of the summer break to keep my creative juices flowing,1
i sucked on his tongue not yet feeling very eager to get his own inside that dangerous mouth,1
i feel like a moderately successful author even though im not getting any where near to rich,1
i feel shaky in my grasp on the fashion,4
i am left feeling angry and cynical at the world,3
i feel left out unimportant and disregaurded im losing you to people i cannot stand,0
im wondering whether to be glad about the way ive been feeling lately or a bit frightened by it,4
i chuckle and feel a little dirty all at once saying it,0
a friend was unpunctual,3
i cant believe how amazing i feel i can run and play with my daughter and my back doesnt hurt and im never out of breath,0
i am feeling somewhat apprehensive about my checked bag being aboard the correct plane but also have no desire to run around the airport like crazy woman trying to find out from someone if it s really on there or not,4
i are somewhat newlyweds married for almost years not sure how long you can have that newlywed title we moved into our first home in and i feel like im still decorating and making it ours but im loving every minute of it,2
i am tired of feeling anxious and im tired of feeling the comedowns,4
i feel as tho my personality is not enough no matter how much i help someone or put them before i am always punished on the back burner,0
i feel that it is special as regardless of how good you are in terms of academic they smu will ask you to go for interview,1
i dont think that i could live my life happily without pushing the limits making myself feel slightly uncomfortable or stretching my brain,4
i feel so emotionally drained somedays that falling of a cliff would feel refreshing,0
i feel discontent and hopeless,0
i feel so much culture telling me that i am not important that in the equation of does not matter the voices of weigh more than mine,1
i feel like i m hopeless and that i m unworthy of it,0
i threw out most of it and made the long overdue switch to spandex and so far i look and feel terrific,1
ive been hating the feeling of being alone,0
i am feeling particularly mellow today though due to my minute aromatherapy massage with relaxing aromatherapy oils,1
i feel so devastated when my teenage daughter criticizes me,0
ive been feeling a little lonely recently as my friends are spread all over the country so today i decided it was time to put myself out there and make some new friends so ive signed up to some classes at the gym to hopefully meet some new people,0
i believe itll teach me how to be more myself how to feel less foolish when it comes to those things i cant yet speak of but can only barely slip out in a whisper things i could deem as crazy as how kempe weeps over christ over her sin over the sins of others,0
ive learned to forgive my spouse when he disappoints me or when i feel he has wronged me,3
i used to feel like even if i really truly fucked up oh well i would just go live with my mom again she d make it all better,3
i also remember feeling a sense of joy and accomplishment when it was over as if i had helped mom in achieving something special for our family and for the lord,1
ive got a feeling im falling love me or leave me sweet savannah sue valentine stomp,1
i am feeling uncomfortable with where this conversation is going and i would like to put it off for another time,4
i feel completely devoted to you,2
i feel worthless and small,0
i feel assaulted here why cant we do something,4
i feel the earth move which shows you what an amazing era the early s was in music,1
i feel sorry for her she had a good thing in dh but she abused it and him resulting in his depression and diagnosis of generalised anxiety with panic features and then lost it,0
i feel like all the wonderful great things ive read all week have vanished from my memory,1
i do feel overwhelmed about some things like cleaning my room and getting things together before i go home again this coming up weekend,4
i left also with the feeling that i had been somewhere that was keen to offer good service and good food at a reasonable price and that what i thought and the impression i was left with mattered to them,1
i feel so empty thats wierd,0
i am feeling now is like a dull ache that is just always there sometimes i am sitting right in it other times i am aware its there but can distract from it,0
i feel pretty pleased with this run,1
i love the us with all my heart and feel very devoted to my country but honestly if i had a way to make a land friendly living in the scottish countryside and be able to choose decent health care options i would jump at the chance,2
i was feeling too much like a dirty ajumma there for a while,0
i love the way it feels and it makes the most pleasant rattling noise,1
i have a feeling he is not very fond of my semi autistic features,2
ive been a mess all week and i feel helpless sometimes,4
i can feel every vein on you bumping against my tender hole,2
i feel my time is so precious,1
i feel so needy its pathetic,0
i knew for a reasonable certainty that these meetings were not helping me much then i would feel perfectly fine with deciding to stop going,1
i rangoli it made me feel very envious on her nose ring and i felt like that nose ring was the most privileged ornaments searched by a frogman,3
i feel guilty that this baby is just hanging out on the back burner,0
i feel so melancholy everytime i blogging and listen to this song,0
i just hate feeling so annoyed with him on the morning after our third anniversary,3
i feel the mac is a much more elegant and simpler interface and user experience,1
i along with our three year old beagle baby boomer put melbourne beach in our rearview mirror feeling a mixture of melancholy sadness and the excitement that only comes with beginning a new adventure,0
i am so thankful for the work that cgi is doing in this country and i am feeling incredibly blessed to have an opportunity to be back here,2
i did not feel the connection to my own experiences or the sense of nostalgia that i was told i would feel from all the positive reviews,1
i now feel a strange connection and fluidness with the world,5
i feel like most episodes would revolve around ralphie getting in trouble after falling in with the cool wildlife who convinced him to vandalize the community swimming pool followed by his redemption and a tacked on plea to not drop out of school,1
i slowed down i was still feeling some pain in my hamstrings and i was irritated at myself for not taking more days off this last week or at least from not doing turbo kick on saturday,3
i produce on a weekly basis feels rushed and i consistently find myself publishing for the sake of claiming i did so on a wednesday,3
i feel sooooooo petty,3
i cant fully explain why because it wakes me and im exhausted and sometimes i feel profoundly irritated having to wake up and do it but the fact remains that every time i do it i am filled with a loving devotion that is so tender i often find my eyes filling with tears,3
i feel the need to be humiliated for failing to be a real man,0
i feel he is ungrateful for the hours i work each week,0
i feel remorseful that i may not see these people again,0
i could carry out my plans tomorrow feeling like this but it wouldnt be pleasant for anybody else involved in my plans,1
i don t feel ignored by white house,0
i will talk briefly about something nice that i did today so i can feel like i broke even,0
i feel like i can relate to him besides being such a handsome black man in the fact that even in the face of much excitement still being able to keep grounded and focused,1
i could explain it is to say that it feels like eli is as low as he could possibly be and that he is turning his head from side to side between my pelvic bones,0
i just feel disheartened when i go from number three to number out of being forced down for some unknown reason,0
i have had several episodes of feeling extremely uncomfortable and getting sick,4
i did and now it has been almost months later i feel free,1
i often feel quite inadequate due to my own experiences my own battles and when my health issues that cause depression and fatigue creep in i can often feel downright defeated,0
im feeling very aggravated,3
i feel very real while feeling extraordinarily fake,0
i hated to admit it but i think it made me feel that way because i was afraid it could be me someday traveling between worlds,4
i feel makes each piece really special,1
i have reasons to and i feel that i should share some of these even if its not the most popular thing to do today,1
ive asked to trust i expected to feel trusting,1
i look at those pictures of me in paris and i feel amazed and grateful and reminded of how dang short life is,5
i hope you know and understand how loved you are by god who cares for you when you feel worthless and that you dont matter,0
i feel rude like im staring and i dont want to make anyone self conscious or uncomfortable or feel like theyre being judged,3
i feel very honoured to be chosen especially considering how ridiculous my film is p if anyone lives in oakville ontario or the surrounding areas feel free to go check out the screening a href http animation,1
i feel myself getting a little complacent that if i m not getting the results i want it s most likely because i m doing what i ve always done yet expecting more than what i ve always gotten,1
i feel like a smart ass up there entertaining people and telling them information they could just as easily read online,1
i had in my life was to find cheap truck insurance i would feel pretty gloomy,0
i vote at every opportunity as i feel its my duty but i am more reluctant than ever to give these people the few minutes it takes to put my x at the side of their name,4
i am feeling much more confident about the situation with nt,1
im feeling pretty impressed with my selling skills right now,5
i cant cry but feel too timid to screem,4
i feel as if i could go on and on but for the sake of bandwidth i am so considerate,2
i sat down next to him on the bus and couldnt help but feel a bit smug that id stopped his avoiding game,1
i am no longer feeling the pain of saying goodbye to our beloved sitter,2
i dont know why i always feel like the ugly duckling,0
i seriously feel that this can be counted as a retelling of the popular fairy tale,1
i was just randomly talking about it and how i found the once more with feeling cd and listened to it and was quite eager to watch the show again,1
when i found out that my father had lung cancer and they did not know how long he would live,4
i start to feel the cold,3
i was feeling a little melancholy with all the changes in the past year,0
i feel like an idiot for trusting him when i feel i should have known better,1
i would like to know if the reader of this post feels completely assured that intuition is a good source of justification and knowledge you can feel comfortable to indicate papers dealing with this question,1
i went downstairs feeling a little strange and washed up the plates by the sink i generally tidied the kitchen looking in the laundry room i found the clothes bin full and decided to pass some time by doing their laundry,4
i feel like i ve been fucked over by one too many people in my life,3
i am feeling a lot more positive about this,1
i feeling so devastated,0
i feel like i don t know how to trick myself into being charming,1
im feeling sososososo troubled,0
i had one of those one hour of sleep at a time nights interspersed with nightmares of varying degrees of nightmarishness so i woke up feeling none too pleasant,1
i just feel very irritable and i want to snap at the smallest things and really have to hold myself back,3
i feel horribly sympathetic towards those at the bottom end of the socio economic ladder,2
i hope that if they feel that way at school they will be glad to be there and do whatever it is were doing,1
i feel a bit uptight i have a few beers,4
i feel like being rejected and this really hurts,0
i feel confused and uncertain which direction to turn,4
i can do it bt the least let me feel that ure supporting me and behind me all the way,1
i was feeling pretty crampy,1
i did not feel that the author really put much of himself into the book and i would have liked some more discussion and analysis,2
i feel like i am being abused but oddly enough i sometimes doubt that,0
i feel like the tools that i have to use for keeping the peace demand that the situation be determined as either,1
i know how awful i would feel if i gave someone i liked nice presents only to have them toss them back at me in front of an audience,2
i feel elegant with my new look short hair glasses amp dressing up all the time,1
i find i can speak what s on my heart without fear of judgement i feel i am not alone and that other men are similar to me they too have been hounded by addictions pornography computer games sex alcohol and drugs they too are wounded by the world they too know what it s like to be truly alone,0
i feel rejected by him,0
i feel so extremely successful and not just because i can greenlight a movie now,1
i feel so lucky to b,1
i remember feeling greatly disappointed,0
i always have great intentions of stitching on ornaments or the like throughout the year only to fizzle out about half way through and find myself feeling regretful about late november that i didnt get more done for christmas,0
i have learned to cope how to pull myself out of a slump and how to know when it is okay to feel sad and to do nothing and when it starts to be something unhealthy,0
mugged while on holiday in the usa,4
i was also feeling kind of disappointed with the fact that i just didnt have any power in my legs for the sprints,0
i sit naked feeling very comfortable in my own skin as i hear the odd call of nature in the distance a bird the insects drumming in their too own little world,1
i feel privileged more honoured because it was not the career i had in mind,1
i am so excited to have a tree this year and really make the apartment look and feel festive,1
i would never hurt grandmas or your feelings just to be hateful but if something is said by you or grandma that hurts my feelings then it will be addressed,3
i feel as if the skeptical family has also suffered a great loss,4
i look forward to the workouts feel tortured during them and experience a mixture of relief and gratification when the running is done,4
i designed the retirement detox course for all those people who are maybe feeling a little disillusioned with retirement and are wondering is this all there is then,0
i didn t really feel weepy but i felt like being handed a gift i have waited for a long time,0
i look for a while i was really feeling impressed with myself and proud with my progress which is affecting my self esteem and making it all just that much harder,5
i woke up in a depressed funk but then started thinking about all those with infinitely greater cause to feel distraught either immediately or over the next four years,4
i feel so fucked up my by big brother,3
i feel very smart that i managed to figure out they were letters,1
i cant help but feel neglectful,0
im feeling pretty pleased with myself tonight,1
i found some pants on clearance at gap which were exactly what i like very lightweight cotton with a baggy feel and casual outdoorsy look,1
i hate what i do as it is having cross orders coming at me left right and center is not improving things and i feel more and more like i m in a hostile work environment,3
i feel more respected,1
i guess that s why i m feeling a little sentimental,0
i am feeling more confident that we will be able to take care of this baby,1
i feel so foolish i dont know why im still hanging on but i just wanna say i just wanna let it out to make myself feel better and say that i still miss you,0
i tried to make them feel the feelings of a tortured person,4
i stood there for a minute trying to figure out why i was feeling so strange when it hit me like a ton of bricks i was pregnant,4
i could feel her heartbeat quicken my own cock aching as i entered her tight cunt over and over,0
i feel amazed at what happened last night with maisi,5
i desire to fit in and feel accepted in a new environment and will place me where i need to be each and every day,2
i also have little frangipani blossoms on my desk candles to create a feeling of warmth and gorgeous scents infusing the air,1
i am currently feeling anxious a href http emmaelizabethchristensen,4
i felt awkward and uncomfortable i hated myself for feeling that way and i hated them for making me feel that way,3
im feeling the effects and my body and wallet are not thrilled with me but for the first time i dont feel guilty for the endless party and focus on fun,1
i do feel doubtful about my relationships with the people who surround me i know there is at least one which i can count on,4
i feel free to argue informally to have real sometimes uncomfortable discussions and to leave the final decision to the team that will execute it,1
i feel like a clever monkey trying to explain to beethoven who is deaf and dead the joys of flinging poo,1
i feel i m a very friendly person but maybe i m doing enough but i think getting close to camera lens is the hardest for me,1
ive been there two years now and i feel confident in my knowledge that nothing phases me i dont need to bluff my way though things and more importantly if something needs doing i can get it done,1
im feeling optimistic about the week ahead,1
i just want a boy to feel respected by to spend time with and to care,1
i get the feeling though that by the end of this i am going to want to destroy something cute and cuddly,1
i started with a headache which eventually led me to not feeling well all over,1
i usually left feeling offended or angry about something he said in class that pertained to the lesson,3
i find it ridiculous how often i feel annoyed or irritated,3
i truly feel passionate about literacy and writing skills and imagination and combined mental emotional growth through the written word,1
i have been changed dramatically with all the mess and i am frightened of asking b how he feels because i am frightened of being hurt again,4
i am currently feeling rejected by someone i know,0
i can shut the book exit the cinema with a smile and feeling contented,1
i listen to vecktamiest grizzly bears most recent album out closed my eyes and felt the universes conspiracy to make me feel worthwhile,1
i wanted to do was educate people that the child feels rejected still when placed in open adoption,0
i have the feeling im now buying manga as well as anime faster than i can get through it i picked up the first volume of a new series from them not too long ago,1
i feel so relaxed and balanced and great i can definetly recommend this kind of vacation,1
i feel rude every week cuz i answer your questions and dont have much time to tell you how excited i am about the things happening in your lifes and how much i love you so i just hope you already know,3
i will feel i have resolved to not give myself a hard time and to move on from it as soon as possible i am determined that i won t quit quitting,1
