text,label
i am posting this not to whine although a couple of days ago i sure would have liked to but to let you all know what it may be like to study abroad for such a long time and to feel homesick,0
i feel like i make some wonderful and unexpected friends during this trip,1
i didnt bring her to my house to meet my parents or like show her the estate i live in or what cause i got a feeling its gonna be damn boring showing her woodlands lol,0
i had been feeling positive and formed a routine with my exercise which is very minimal and consists of lying on my back trying to meditate a bent knee fall out and leg slides,1
i woke up this morning feeling like it was the summer of discontent,0
ive also been wondering when is drake going to drop a new album because im feeling deprived and im burning out his take care album,0
i am feeling hesitant this morning,4
i still had sufficient hair to feel shocked when i was subjected to the brutal trim administered by an army barber on my second day at catterick as a national service man,5
i feel worthless all over again,0
i found myself feeling regretful when she turned away to complete my order,0
i hate to see him feeling miserable,0
i was feeling like i hated winter you know cabin fever until i got out there and did something besides drive my car on icy roads,3
i feel curious about everything,5
i feel so aggravated,3
im feeling queezy and cant be bothered putting these in order so here goes,3
i realised that he is sensitive so ill try to make him not feel offended anymore,3
i was bored and feeling adventurous so i had a genius idea what if everything i wrote onto my usb also got synced to a cloud service,1
i feel like i should be surprised but somehow i m not,5
im feeling inspired to just wait for the movie,1
i believe we are always called to get to work to stop only feeling loss or sadness and to begin again with a faithful step forward,1
i get this stressed out all i want to do is sit down and write out my frustrations set them free and feel relieved that i dont have to hold onto them any longer,1
i was this overly dramatic teenage girl who felt things too sensitively just because i feel as if i am numb right now,0
i feel bos is really friendly looking and that s why i used it,1
i feel like she seems much more mellow since starting to date him,1
i feel really naughty and a bit guilty because i know how bad it is but ive already done it twice,2
im not feeling too friendly towards this lycee director so im not particularly looking forward to showing up tomorrow to paint,1
i feel invigorated and full of energy,1
i was feeling particularly gloomy,0
i remember sitting on the couch with a towel around my foot to stop the bleeding feeling defeated,0
i just wish there was a little more to it than the feel of a pleasant home movie as valuable as it may be to understanding him both as an artist and a person even a little better,1
i am around those that love me i feel amazing,5
i know but i do have a fantastic babysitter their second mum and what i really mean is that feeling of doing something a bit naughty,2
i had to explain this saying recently but i think it is a good analogy for getting yourself ready to create especially when youre not feeling that creative,1
i feel better when i ponder for a day,1
im feeling a bit rebellious and have been pouting most of the day,3
i cant help but feel bitter and jealous he takes her out to eat to the movies gets her presents sometimes and he uses the excuse i only do that to get her out of the house if i didnt then she would never want to leave,3
i started paying attention thanks to s madonna a song that had a slight new jack swing kind of feel long before shinee was oh so curious and their recent comeback centered around the single poison from their third official mini album feels a bit like madonna part,5
im not trying to be a bitch nor am i trying to hurt your feelings i just need to bring my guard back up amp protect whats been constantly and repeatedly damaged,0
i stay away from carbs nowadays gosh thank you for making me feel ugly oopa,0
im tired of feeling intimidated or shamed for having valid concerns about the escalating problems in this nation with the use abuse of weapons and i want to see something done about it,4
i feel for people i am a sympathetic crier amp a softy when it comes to sob stories amp other peoples hardships i feel for them it honestly makes me hurt to see others in such pain,2
i read about the most recent and most common reason why delhi is always in the news and i was feeling shocked horrified deeply pained and shameful to feel aware i am not really able to do anything substantial about this persistent problem in the so called capital of this country,5
i finally feel respected as dhs wife,1
i wake up get ready for the day and then immediately sit down to write i feel most productive and inspired to forge ahead,1
i forced myself to start looking for her and with a feeling of terrible dread began to gently push away the bedding in the habitat,0
i only use it when im feeling really casual and im not going out,1
i would be alone but i wouldn t feel rejected it would be by choice,0
im feeling a little sentimental right now so apologies in advance here comes the gushing,0
i was feeling a bit depressed so i opened my bible to a random page,0
i feel theres something vital missing from my identity,1
i have no allusions that kucinich will get any traction in this race just like he had no traction in i do believe that people dislike hillary but feel resigned to the fact that she will win,0
im too busy feeling mad and disgusted to care about my appetite,3
im feeling so unsure when things are pressing in about me comes a gentle voice so still so pure slow down slow down be still be still and wait on the spirit of the lord slow down and hear his voice and know that he is god and know that he is god,4
i pray i wont feel shy or awkward,4
i feel almost hesitant to commit to it because i dont believe that ill finish it,4
i often times feel helpless in regards to my life s path,4
im really feeling bitchy today yung tipo na i want to kill some one parang super over the top ang angst ko ngaun,3
i think she is starting to take it as not threats but i think she might feel like agitated when i talk about it,4
i don t feel welcomed here it s more like i dunno,1
i was like feeling really greedy but what the hell,3
i was at program during the day where i was in touch with my feelings supportive of other people and present,2
i feel that trophy hunters are nothing more than bullies they just pick on other species and prove nothing because when one has such a ludicrous command of the situation that he can kill before the other animal even senses that he exists theres nothing to gain,5
im left feeling like im clinging to the vestiges of a life i once loved,2
i am warming up in front of a fire i have my new buffy comic a couple of books of poetry and i am feeling terrifically geeky in a town friendly to geeks,1
i feel like he was being sincere but maybe couldnt do it for some reason,1
i might if i am feeling homesick attend a wod at one of the cross fit gyms over there,0
i feel like i need to keep pinching myself to be sure tis is all real,1
i just can t shake the feeling of discontent,0
i know a false feeling even as i am glad to see old friends with my copious spare time they are themselves restricted by jobs and real life responsibilities things i have only temporarily escaped,1
i will buy myself a gorgeous leopard print coat and i will feel glamorous wearing it out this year,1
i feel bad because i like him yes,0
i get back on the bike and it feels fine i can eventually put some speed into the swimming and biking i have enough time to do some training the august triathlon may not be my first tri,1
i thought that all those things we dealt with on a daily basis the let downs the arguments the unspoken words the spiteful comments trying to make up without feeling resentful trying to make things better i thought i d get peace from all that when we broke up,3
ive had an uncharacteristic amount of patience all around and i feel fantastic,1
i am beginning to feel truly festive even more so knowing that we will all be on holidays in the next week,1
i have worked hard to get to where i am today and i feel that i deserve to be proud of my hard work and accomplishments,1
i guess this is the part where im supposed to feel triumphant,1
i would feel bad,0
i am right and there is no reason that i should be then a way to reduce anger is to help people feel valued,1
i always feel a bit foolish after losing it like that not that he doesnt deserve that plus a whole lot more,0
i feel like i shouldnt have rushed so much with scotty ahhh signs of personal growth folks isnt it great,3
i understood that commemoration memory and historical consciousness are important parts of fostering a link to feeling sympathetic towards history and a sense of worth or ownership towards it,2
i dont know y but i feel a little disillusioned by all this i just hope that the country s policy makers think over this,0
i am back home and it feels weird after being away for a month,4
im feeling jaded a bit sad and ready to see my family again,0
i feel very disturbed by something i read just now,0
i still feel completely resolved,1
i suspect that youve never had this feeling but rest assured that it has occurred to your boss as she buzzed by your cubicle and wondered aloud is he seriously working right now,1
i can breathe his scent the first time i will feel his embrace if only in a friendly hug in five years,1
i feel like an ungrateful ingrate,0
i could feel their skeptical smiles,4
i feel privileged in my perspective because ive got the immigrant side being that my dad immigrated here as did my moms dad from scotland,1
i have a strong feeling that in a month theyll be reporting a tragic miscarriage if you get my meaning hurr im no tinfoil either,0
i feel very unimportant in that regard,0
i was just feeling too crappy during the first weeks to do that so here was our half assed attempt at something cute,0
i determine that i deserve to be put aside and i feel terribly surprised when i am not,5
i actually switched teams in unravel me and i have a feeling that im going to have my heartbroken in ignite me,0
i feel that this one needs some picks in it to make it cute,1
i feel that i should have something intelligent to say about last nights primary results but i really don t,1
i feel like i have a little de javu feeling about being accepted in this uni you know,2
i feel so pained right now,0
i don t feel rotten at all tbh that s the worst part,0
i like christmas festival i feel its lovely everywhere when i see the decoration in anywhere,2
i feel a little bit stupid for only just agreeing with your point now because when i think about it now it just seems terribly obvious to me,0
i have a meager books on it now snicker and feel so greedy and gluttonous with reams of words spilling out of my hands piling up around my feet causing me to dance in rapturous glee,3
i feel lucky to play a small p,1
i got the feeling she was thrilled to hear a girl phoning for her son,1
i feel an anxious anticipation,4
i feel like my brain and artistic self get a quick wake up when i check in throughout the day,1
im feeling needy he tickles and rubs my back whenever i ask him to and he is so considerate and thoughtful,0
i just havent been eating much because i feel awful,0
i know i moved past the feeling part of loving korea to the action,2
i love friends and thats why i feel so miserable without them,0
i feel horrible about all of this,0
i remember feeling so hurt confused scared angry and bitter with god myself and everyone around me,0
i begin to feel a bit wimpy as i see mile runners with that last adrenaline kick passing me,4
im also feeling quite amused by all these good looking guys around me not necessaily friends just walking by lol,1
i went to bed early last night like oclock early because ive been feeling so drained and an almost hour er visit didnt help,0
i feel may be useful,1
i feel this exercise is doomed to fail as society becomes an ever increasing hodgepodge of regulation without any real basis in fundamental principles,0
i lead an incredibly fortunate and blessed life so asking for more feels incredibly greedy and selfish,3
i started feeling a bit depressed and wanted to do something about it,0
i got that straight i realized that i was dealing with someone who was feeling insecure,4
i feel really scared and i guess thats normal but,4
i have ignored them so much this past year that playing with them they feel tender and sore but it s still turning me on like crazy,2
i have been waiting for this novel for what feels like forever what with the super cliffhanger ending that was cofa,1
i feel inadequate to live up to it,0
i have no hard feelings tonight but i honestly dont think he will be faithful and committed to her,2
i hope you like it i feel very comfortable with all of this,1
i was really feeling it and seeing stars but i m glad it happened there and not here,1
i am feeling happy and classy i would wear jeans and a nice shirt,1
i know that will make me feel much more lively then i do right at this moment,1
ive never been the mother of a teenage girl before but i sure as hell have been one and this little episode would have left me at feeling ugly and crappy and humiliated,0
i feel when writing can easily make up for being ignored or passed over,0
id noticed that my moods were going through phases where at one point just prior to asking for a referral to the laurels i was feeling really depressed and suicidal at least once a month,0
i will admit to feeling annoyed even before reading the article,3
im always reluctant to do posts like this because it feels so vain to presume that anyone would care to know more about me but considering we are all nosey by nature which is totally different than a href http en,0
i am feeling pretty lovely today,2
i am part of the entire j family it makes me feel valuable to be a part of j,1
i feel blessed that i am able to make our house a home,1
i don t know what to do i feel like i m being selfish because i need my mum when my sister apparently needs her more,3
i really feel like i have the most supportive group of readers at this blog even if the topic happens to be my guitar teacher s bitchy wife,2
i loved the feeling when someone clicked hostile your heart always started to pump a little bit extra in those games especially when you were going to enter a wp tp,3
i feel the only reason you would need to tell a casual relationship anything is if you have some kind of sexually transmitted disease,1
i know now the real reason i included myself in that child play was to feel accepted and a part of something,2
i feel i need to know at least a little something so i can contribute to casual conversations,1
i feel hated helping prevent gay teen suicide by rev,0
i had started to feel somewhat jaded with what i saw as my duty to the environment my own cycle quest,0
i used to feel impatient that my work as a writer seemed to inspire others to jump into the fray,3
i skip a run i start feeling eager to get out the next day,1
i dont really want to move because i do feel some emotional ties to this house,0
i feel so blessed to have the ability to take the day off buy delicious food and sit down and enjoy life,1
i want to feel hopeful and happy again,1
i still feel angry and with reason to be so,3
i believe i am feeling that romantic nature for you but it does not make sense,2
i am sat at home resting and recuperating or at least trying to i m feeling quite calm and enjoying sketching with my feet up so i thought i d choose some serene watercolour paintings from a href http www,1
i feel completely dissatisfied with everything i do,3
i feel half sympathetic towards him,2
i had moments of feeling overwhelmed and spent a few sleepless nights with my mind racing over details of decorations programs wedding favors a church reception and an rsvp list of people,4
i tries doing some prodding about how joffrey feels about the lovely margaery,2
i need to feel something i just feel numb and stiff as a rock,0
i feel assured she would never,1
i feel lucky to be exposed to the variety of people habitats conservation problems and research questions associated with each of these field sites,1
i just feel disgusted at the amount of greed here,3
i told him i was feeling damaged,0
i can see i need to update my totals on my pages that will make me feel better,1
i dunno it feels like you should be since she is the most god damn beloved character in the game right next to rinoa,1
i don t appreciate you guys caring and checking in with me but i m feeling a bit pressured because i honestly don t have anything new to say and i feel like it gets so boring reading the same thing on here day in day out,4
i need to do praying and being closer to god always makes me feel more peaceful,1
i don t put up my poetry here nor some deeply lucid thoughts feelings i put up my feelings clubbed with some quote or lyrics of a song i liked,2
i am hear for you feel free to write to me tell me what is going on in your life,1
i am feeling better though i dont sound it,1
im always feeling mad this past few weeks i dont know if my period causes me to act this way but i can no longer contain this feeling anymore,3
i go there i feel like i m supporting the local startup scene says shapiro,1
i like how whimsical the cup is with roses and fancy chairs done in black and white and the rim is a bit delicate which makes me feel more elegant than i ever am in real life,1
i experienced anger most recently when i had committed a sin which i had gone a week and a half without doing i had made a vow to god and had blown it now i had to start all over,3
i do waste some time that way but i feel like i am so much more productive now because i spend so much time reading,1
i feel honoured to be given an insight into so many peoples lives and i love the connectivity of the blogging world,1
i took her in to see jenny the morning after we made it back feeling horribly defeated and she was equally mad,0
i feel fucking awful cause you just kissed that bitch you fucker,0
i feel like getting distracted,3
i witnessed the aftermath of two guy friends of mine who had received compliments that bolstered them to a higher level of feeling valued,1
i remember feeling groggy and disoriented as i walked into the brightly lit kitchen where my mother was just getting dinner on the table as though i had been away on a trip and was just getting back,0
i come from there is this thing which i think could be called comfortable silence there is no need to fill every moment with banter but you can enjoy the silence as well and no one in the room would feel uncomfortable,4
i felt relieved with a lingering feeling of disturbed and disgusted,0
i really am feeling contented this evening and i feel at peace,1
i feel you re heartless,3
i don t want to feel afraid when i hear your footsteps behind me at night,4
i am feeling restless and i know that i need exercise,4
i really feel like there is a delicate line to this particular aspect of the animation especially outputting the relative information,2
i feel for my beloved,2
i feel awful he lost his mother his wife his house his dog since he has no where to keep her,0
i get into a good pace and feel like i can do it forever and i get distracted by something which in turn messes everything up,3
i feel very much loved and yes this is simply an example of the love that goes around this beautiful school,2
i couldnt go to a college dance a bluegrass festival a rock concert without feeling paranoid,4
i got to consider once im feeling curious,5
i was feeling outgoing and noticing he was wearing one of those trendy bracelets like my bekind bracelet i asked what cause his might be about,1
i get the feeling your girlfriend might not be too keen on the idea,1
i think i enjoy feeling long suffering and persecuted,0
i feel some comfort in the suffering that i am going to go through,0
i feel i ought to say ive been genuinely surprised by the degree of sympathy mr huhne has attracted in certain quarters,5
i was feeling kind of rebellious and my post was a little on the,3
a situation where i ignored my beliefs and principles for a trip of whimsy,3
i feel especially thankful for the many good things that have happened in my life,1
ive had thanksgiving dinner on my deck im nervous about getting the critique and feeling inadequate and getting sick,0
i feel that this is not bad,0
i know that she may have had some kind of feeling for him i do not know but if i saw her talking to the guy that i had thought was cute i would not have reacted in the same way,1
i mean it s not the law but that s the idea with the smaller releases that it starts with something that feels precious and personal,1
i would go into greater detail about all of our decorations but honestly i just woke up after falling asleep on the couch while watching the bride of frankenstein and i am feeling a little cranky,3
i feel like the insecure child afraid to make any move concerning my child out of fear that it will be the wrong thing,4
im feeling really rotten and disappointed i guess,0
i feel so glad i feel so glad because i dont have to face things alone sometimes while i still prefer to be the strong person that i always am im still really glad that i have you thank you for willing to be part of my life,1
i hold space for these feelings the anger the jealousy sadness and despair the longing i can relate to those feelings but not have them devour me,2
i couldnt help but feel discouraged i also couldnt help but cry,0
i felt feel so vain and shallow,0
i feel that it s important for me to share my feelings about what i m going through honestly and unfiltered,1
i have so many beautiful books around me every single day whether i m at home or at work and i feel so thankful to have all of these words that i can consume for days on end,1
i feel amazed that i am breathing air at this moment,5
i sleep in a little longer and by the time i wake up i already feel super sick because i dont have any food in my system,1
i havent jumped on the feeling thankful facebook trend but tonight i feel that a bit of reflection here is appropriate,1
i do feel like ive had a peaceful visit to the country after reading her blogs,1
i feel pretty src http cfc,1
im talking to her i just get too excited by good conversation mixed with the unmistakable feeling of being hopelessly in love that my body starts to tingle my teeth and hands go numb and i get light headed so for the sake of our safety on i i slowed the conversation,0
i was feeling very lonely and tired,0
i have been trying to rest but have been feeling somewhat shaken,4
im feeling stressed i can sit down and open pages of music on the piano and play until i feel soothed,3
ive come to the realization that amongst the complacency ive felt recently im starting to feel discontent being that,0
i begin feeling a weird vibration in my rear end,4
i wait so long every year when i know how absolutely heavenly it will feel katie had an amazing girl do her hair strawberry blonde,5
i only casually mentioned what i desired what i thought would make me feel more submissive,0
im hoping they wont feel that longing to belong that always nagged me growing up,2
im walking a beautiful trail surrounded by autumn leaves feeling the cool autumn breeze on my face i miss her,1
im feeling a little confused and despondent,4
i want to scratch that i know i will feel fab and look smashing,1
i didnt mean to william sobs and those last words sends shakes into gabes body it racks his bones and gives his nerves a chance to feel something not too pleasant,1
i feel cool when i master a complex excel formula,1
i am i feel that i am doomed to have a space that is entirely filled with bogus advertisements and my incompetent attempts to actually make this space worthwhile,0
i am feeling seriously angry today,3
i am super happy i think if i die today i would at least feel contented,1
i hate it because i know what could fix this but when i feel this i just feel selfish,3
im feeling resentful and persecuted about that whole aspect,3
i have a livejournal and i can feel a little less inhibited when writing in here,4
i am now feeling determined to finish this travel themed moley,1
i feel that meditation has helped me go into the very roots where suffering is created,0
i walked around feeling intimidated for like sometime before i got the guts to walk into a shop,4
i could feel the water supporting me washing away bits and pieces of that perceived stress,2
ive been feeling really inadequate since i started the masters program here,0
i think probably beatrix potter or something my mum was always getting us books and reading to us as infants she gave me a catcher in the rye when i was about or i remember feeling really smug and mature reading it all i remember of it really is that it seemed to be steaming and moist,1
i feel honoured and my joy overflows,1
i just feel that noone is trusting me enough to give me more responsibilities,1
i feel more mellow now,1
ive been getting that nasty bloated sleepy feeling each time after consumption and i am so sure i am not losing weight because of it,1
ive been feeling lethargic,0
i feel like i ve lost all desire to do anything lately,0
im outta control feeling so mad like im gonna go and cut my hair cut my hair,3
ive been re reading many of my childhood favourite books lately i dont know why but its suddenly all i feel like reading childrens fiction and books on backyard chook keeping in preparation for getting some lovely pekin bantams next year,2
i was starting to feel bitter yesterday about how out of place i feel at this school and every school event,3
i feel as if she also respected me,1
