text,label
i feel too lethargic to continue anymore,0
i was feeling more than a little embarassed and frustrated by the experience,3
i dont know whether to be happy or sad but i obviously feel insulted and hurt that they think this way,3
i really shouldn t feel so clever for this encoding utf isprivate false languagedirection ltr feedlinks uclink rel ud alternate type ud application atom xml title ud l chaim atom href ud http solamentebeth,1
i was a very nice girl and i was very unhappy and makeup made me feel like i could hide my innocent little self swap it out for a tough look and pretend i didn t care,1
i just feel like so messy and dizzy,0
i find that when i am feeling bitchy after a day of work talking ghetto makes me feel better,3
i feel like its been all in vain current mood img src http x,0
i missed feeling like i contributed to supporting us and i missed treating my husband to things,2
i feel very lucky not to have to go back for a nd day of collection,1
i can really decode but im sorry i have to vomit my feelings out because i am so cranky and everything is getting on my nerves,3
i mean do whatever i want as in doing things i like to do and not feeling bad about it,0
i feel safe now lol,1
i feel lousy emotionally all jagged and out of sorts,0
i went from feeling bothered that my time was being used for something that i didn t value to feeling very appreciative for the opportunity to learn,3
i asked readers what makes them feel glamorous on a normal day and the answers are great whenever i need a little pick me up i always thrown on one of my favorite necklaces,1
i was feeling rather cranky and sorry for myself,3
id welcome any comments that you feel could help our sweet writer,2
i feel like the dust in me has been shaken and still has not settled,4
i also feel frustrated for the ways in which it is making my life more difficult in the short term and for the inconvenience of it,3
i wanted to do some research and find out why this was such an important step in my nail service rather than just feeling amazing,5
i didn t say anything right away but thought to myself it s been awhile since i ve made people feel awkward,0
i feel passionate about is not spending a lot of money on clothes,2
i never feel so suffering,0
i cant say it necessarily hurts i just feel like everything is stressed to its limits and not flexible or mobile as it used to be,3
i feel i try it dangerous hardly comeback because it runs so fast may make pain or make me die frighten don t have anything capture it s late to comeback,3
i want you to feel your perfection to wrap my presence around your consciousness to let it penetrate beloved ones all that you truly are,1
i feel so virtuous eating that many veggies,1
i got as far as plot spoiler removed and i think that combined with fatigue and listening to symphony of science i was feeling a little emotional and i am no way going to cry on a train full of mancunians and wiganers,0
i feel the blush as i stare at the peephole disturbed by my thoughts,0
i feel love from lakhs of people but there are lots of people who say rude things about my family and friends and that hurts me,3
i have such a hard time finding mothers day cards with sentiments that feel sincere they all say stuff like mom you re the best mom in the world,1
im feeling rather fond of street and botanical gardens,2
i feel like such a giggly stupid girl whenever i talk about it,1
im never quite sure how shes feeling and i could be babling on about something unimportant whilst shes sitting there thinking bout slitting her wrists,0
i was overwhelmed at work still not getting writing done and making my partner feel ignored,0
i also feel useless that im writing a post and have no real photos to put on to make this post a tad more interesting,0
ive been feeling like a rebellious teenager and that is strange because i was quite sure i was over this phase,3
i feel like im kissing a friends butt that i have wronged somehow and has been mad at me,3
i feel some issues need to be resolved,1
i am so incredibly thankful for the temple and for the blessings the promises and especially the feeling that comes over me when i am either inside this amazing building or simply when i drive by,1
i write i feel calm when i think about it,1
i am feeling so excited and so proud of all of these changes and the progress the princess has made this month i have also felt some sadness,1
i feeling bitchy as all get out,3
i my mizzle gets so smitten over a guy and so i know your feelings are completely sincere,1
i feel quite agitated,4
i just wanna sit and feel defeated and not work out and eat my dinner plus all the livesavers i know are in the drawer beside me and all the candies and chocolates and toffees in the candy jar on the table behind me and the sugary ass drink that s in the fridge,0
i started to feel very agitated and was unsure whether i should bash her on the head or do something else thats equally violent,4
im not sure i could quantify the feeling properly though im almost positive everyone has felt it before and maybe even today with me,1
im feeling rebellious and have decided to post three things that make me happy,3
i feel the comfort and softness in their gorgeous new a href http www,1
i feel jealous angry and sad,3
i am feeling deprived here,0
i was feelin quite hopeless after s mtg of searchin until i found u,0
i know it can be easy to feel dissatisfied and discontent with where you are right now but just be patient,3
i am feeling uncertain it helps to look at her and think about all that she accomplished in her short life,4
i read out of order i feel a bit dissatisfied like im missing something even if the author added backstory,3
im feeling pretty unloved and unappreciated,0
i feel its actually important to be clear about the potentially flawed assumptions at play here and another word may be more appropriate,1
i forgive myself that i have accepted and allowed myself for fearing of feeling helpless,4
i wont have my feeling hurt if you dont read it,0
i used to and i feel like its hopeless,0
ive been feeling pretty sentimental,0
i feel that i have always been rotten at christmas and always as my brother and i experienced extravagant holidays and it seems that our b will follow suit as his first christmas was a showering of love and loot,0
i feel so isolated down here,0
i am feeling resentful about paying a whole lot of money for something i dont love,3
i feel rotten i feel rotten jun th by a href http www,0
i feel you on the impossibility to get those things looking perfect,1
i want to be better at communicating with my parents because i know that one simple skype conversation or a cheeky email makes them feel honoured,1
i cant help it but to feel offended when people responded wow so expensive,3
i feel the need to have a reason or everything i hated that i had to be subjected to thunder and lightening when it was unnecessary,3
i clench to the corners of the bed to feel assured,1
i think i would say that gratitude is an integral part of my soul and i feel that supporting various causes is my way of saying thank you,1
i feel significantly less stressed and got all of yesterdays sheets in plus several referrals and managed to actually do some interlibrary loans and other things for the library too,3
in a sociology class i felt very angry towards some members of society for exploiting the polynesian people,3
i want to cry and do anything but be introspective about why i was disobedient because im not feeling submissive,0
i feel kind of lame that i haven t discovered them or the genre earlier because it is so good,0
ive been free of this before how did that feel what helped me feel free,1
im so afraid to just say what i feel i want to get away from my fearful mindset and just do what i feel is best,4
i was so pleased that for once i didnt feel annoyed that i had to pay cents for my cold water,3
i feel the need to be liked i can t stand it if i have the slightest feeling that someone doesn t like me,2
i feel like theyre people i know and that an artistic depiction of them makes sense because then i can know thats there something else there that i like,1
i feel stupid yes i just graduated from optometry school but yep you guessed it im having to take a particular test again,0
i have a feeling this is going to be one cute feel good movie,1
i just feel that offering an ultimatum would only scare him away and you know how indecisive he can be,4
i feel enraged and feel like knocking everyone of their teeth out,3
i feel completely helpless and more vulnerable than ive ever been,4
i would seriously be looking in the mirror rather than the messenger amp that s how i feel about other people s opinions i feel more adversely for the person who is offended than the person suggesting amp yes i have kids amp yes people had suggestions all over,3
im feeling emotional i write a song put on my headphones and get lost in the music,0
i feel like the addition of sweet fresh corn really adds a touch of summer to an otherwise heavy fall dish,1
i feel more relaxed than squeezing with different genders on a tiny path,1
i kinda have the feeling that this video might be one of those things that maybe isnt as funny as i thought it was,5
i feel strong like i can do anything,1
i will admit to sometimes feeling resentful,3
i feel a bit listless right now,0
i believe that once i work out the toxins i m going to feel terrific,1
i have noticed her face and expressed his with her so much i his eyes and so eloquently withal that the girl was notwithstanding she was such an you make me feel unwelcome,0
i ask students to discuss their feelings about writing some positive feelings usually come up too,1
i feel like i am not smart enough to do the level of work my professors are requiring,1
i always feel hated,3
i feel peaceful inside,1
i am simply feeling so amazed for i know that this would be the only way for me to make the most out of everything,5
i had already worked the issue out in my head but i felt the need to share with a friend and that is allright i know that it is but sometimes i still feel apprehensive,4
i feel a little shy doing it,4
i caught feeling for him and he didnt catch them for me and thus things got fucked,3
i can do something despite feeling scared,4
i feel clever and choose to take an action,1
i feel terrible within like minutes,0
i feel doubtful as if anything of the sort is to happen in the near future at least holding me until college with the single factor placed under my name,4
i feel happy nov,1
i must admit i even feel jealous as a hse person british i could never dare to attempt to try to write such a book,3
i have no problem falling asleep but i feel like ive been restless this week,4
im currently feeling rather foolish,0
i like someone who does not like me and was rude to me,0
im feeling rather pleased with myself over my wardrobe,1
i know i should be feeling supportive at this point of time but honestly idk why but i feel disgusted at how the whole team works,2
i see others succeeding i feel more confident that like my classmates maybe i will also get closer to the perfect law student,1
i was feeling a little bit embarrassed and worried because i didnt know how to adjust myself in the new system,0
i have to admit this is the first year i didn t carve a pumpkin and i feel a little bitter sweet about it,3
i feel quite grumpy and low in the mornings especially when i have not slept enough but then i am not always tired at night and if i am not sick then i like to stay up and feel good for a while,3
i cannot feel perfect every day in every way,1
im finally starting to feel festive,1
i feel is really not worth it not to say that the plan for days is any more worthwhile,1
im so used to hot weather i feel abused when i have to wear jeans,0
i pushed through a mountain of trauma and now i feel strong like the bear,1
i apply it after i cleanse my face and apply toner and moisturiser but i only do it twice daily morning and night cause i feel weird reapplying it in the middle of the day when my face is grimy,4
i feel the delicious cold it s pleasant in my hold and as i press it to my skin i feel the cold sink in,1
i am thankful to have friends that would hang out with me when i am feeling lonely and are there just to listen to my problems or whatever is bugging me,0
i don t always feel like writing funny,5
i feel that i was more victimized by the batterers actions,0
i went through quite a while being terrified that i have all kinds of mental disorders and physical diseases and i kind of rotate between many difference obsessions and themes when i finally feel assured about previous ones,1
i feel like a poo poo platter um an ungrateful waste of space nincompoop arsebucket,0
i did feel like it was kind of an ugly thought to think of such a precious boy but what upset me more than anything was what it made me think about myself,0
i don t want to feel the way i did with you that passionate connection when we were no longer a separate two,1
i am fully within my rights to disconnect from surroundings that feel emotionally and or energetically dangerous toxic violent or totally caddywompus,3
i feel like im getting there i have to admit i was stunned when i realized my list my entire laundry list of here to for impossible pie in the sky dreams,5
i have this recipe in my better homes and gardens cook book that i go to whenever i feel nostalgic for my early days of eating,2
i was feeling brave the other day and snapped some pictures of her during nap time,1
i felt energized in minutes without feeling at all shaky and i felt just like i had a full nights sleep and was fully energized,4
i feel in my heart i will find her but sometimes i feel doubtful cause nothing is even happening,4
i have to say how i feel and be vulnerable enough to state my insecurities and fears,4
i feel his gracious hand upon my life,2
i feel amazed about nearly everything that i m teaching a new course for the first and last time that it s summertime which i know it must be because it s very hot that things are changing so soon,5
i felt completely satisfied i didnt feel frustrated left out or like i was missing out on anything which was great,3
i feel relieved and so happy knowing that they do have amazing grandparents on his side just not by blood,1
i would like everyone to feel beloved of that god who gave his son for us and who has shown us his boundless love,2
i feel so tranquil right now,1
i fucking feel so pathetic,0
i was coping and now i just feel mentally exhausted,0
i feel like im smart enough to know the risks,1
i dunno how yad feel about some of my friends but their loyal lu xun i see,2
someone who was speeding was forced to slow down when i pulled out onto the road and proceeded to abuse me at the next set of traffic lights,3
i cannot begin to tell you how blessed we all feel to have such caring thoughtful friends and family,2
i feel so glamorous my fine hair is no longer an issue,1
i feel infuriated by helplessness and losing the ability to speak and eat what i wish lol,3
i feel we owe it to all of us humans to keep the world safe by punishing crimes to the same degree as the victim has suffered,1
i say i m feeling that agitated and sick from this danged hn,4
i must admit i get slightly annoyed when i leave comments that are never addressed or answered i feel ignored as a reader,0
i have two active blogs when im feeling super im posting to berlin for urban travelers,1
im feeling awfully overwhelmed by everything right now the demands from mother the needs of my family trying to shield my dear husband from as much as possible the list goes on and on,5
i still have the mind frame of a pregnant woman with diabetes and feel guilt everytime i look at something sweet to eat,2
i am lonely alone feeling kinda low but waiting,0
i was feeling rather stressed and tired,3
i feel really happy that i have somehow managed to accumulate so many talented people in my life,1
i dunno but i still feel kind of assaulted in a really good way,0
i feel kind of over entertained,1
i bask in the glow of feeling successful,1
i listened and thought about the system in place i feel like i broke down a tiny cultural barrier as i realized that a free year program sounds a lot better that the extremely expensive and debt incurring year plan that we have in place in the us,0
i feel a mixture between feeling cheated and appreciative of whoever was involved in the production of the ten commandments,1
im hopeful that judd will be able to assemble a cast he feels passionate about and that hell be able to tell some great stories,2
i feel in the typing mood so i might post loads on my blog in this sorrowful day,0
im feeling more mellow than before,1
i feel happy i also feel sad,1
im so successful why do i feel like a fake,0
i was tired of being pissed off all the time and feeling so hateful towards pretty much everything,3
i cant turn to my trusted confidant with it because they would feel betrayed and heartbroken,0
i actually feel accepted besides home,2
i know not everyone loves or feels as loyal to gtcc as i do,2
im feeling rather abused right now,0
i feel on edge frightened nervous depressed und crabby all at the same time,4
i went from feeling totally unloved feeling i didnt have a friend in the world no hope and totally confined to an area,0
i for one would certainly feel at a loss trying to have intelligent dialogue with a piece of cloth especially over an important matter as no doubt they often are that are discussed in these surgeries,1
im just feeling grumpy and blaming and whining,3
i feel like time would just get frittered away into an empty whole lot of nothing meetings browsing talking worrying if not for it,0
i won the grammy that even feels weird saying that my mum said oh lou i found something and you re just going to freak out when you see it,4
i the only who feels lonely,0
i just want my feelings to be respected and they are not,1
ill probably feel a little lonely,0
i dont normally like wearing pants all the time but since i work with a bunch of dudes i feel a little shy wearing skirts or dress or being girly,4
i feel is most abused and misrepresented because we so frequently underestimate what is truly possible and what isn t,0
i feel productive when im paying close attention,1
i expected but interesting once i started translating xd i always feel really obnoxious when i translate like that because im stepping into someone elses conversation,3
i could be digging through the correspondence of late eighteenth century america and would still feel burdened by the necessity of it,0
i feel as if the joy is a ball of fire aching and yearning to erupt from inside me and spread joyfulness everywhere,0
i shall be forced to snuggle in on the sofa with a warm baby and my new camera s instruction manual amp perhaps some cocoa or tea if i m feeling virtuous repentant,1
i feel like fandom might not be thrilled because a lots of sam b almost no sheppard and c rodney being kind of an asshole,1
im feeling pretty stressed right now,3
i feel overwhelmed by the raw beauty of it all and overwhelmed by the mass amount of poverty and problems,5
ive been trying to work on some adult drawings in here but it is rather hard when the guy downstairs starts feeling a bit um eager about what the mind is doing,1
i feel so innocent with the intricacies of the world especially with relationships,1
i am absolutely in love with feeling like a gorgeous hot passionate and full of love woman,1
i feel drained mentally and physically and i really need to get back to a better spot,0
i recently had an experience with a man that left me feeling quite insulted,3
i feel like the way they compare an ltr to things like casual sex and one night stands has a rather shaming element and casts such behaviors in a really negative light,1
i have come to the place where i feel accepted by god when i feel most unacceptable to myself,1
i enjoyed the first months of pregnancy feeling fabulous and carefree,1
i feel this book has gorgeous designs but for some reason never got its due respect shown,1
i could even feel awkward or ponder that thought she was kissing me,0
i feel you all around i feel you near you are there wiping my ever tear you wrap your loving angel wings and arms around me holding me comforting me,2
i got into the house feeling fairly calm the photographer is weaving his way in and out of bridesmaids doing touch ups my dad is telling a story my mom is running in and out of the house i manage to go through my list before the bridesmaids start clamoring for the dress,1
i am finally starting to feel less frantic and more prepared to welcome our new baby girl,4
i think i feel like just went over the hump in thinking only about the time and now loving the work,2
i can grin and giggle i feel the gentle pressure on my elbow guiding me down the stairs to the garage,2
i felt disgust toward meat when i felt sick with the steak after a week only on meat,3
i know how it feels to suffer at the hands of people who feel superior to me for whatever reason and i am not interested in playing that game,1
i feel hated by my country for having the temerity to be a woman,3
im feeling pretty proud of myself with this little snowflake,1
i must admit i am excited to have him go back too although i am worried about how he will handle the transition and i am worried about his ability to catch up without feeling overwhelmed,4
i got there i couldn t shake the feeling that though i was still that beloved friend i wasn t welcome,2
im not the only one feeling confused,4
i am feelings stressed and feel the world closing in because of all that is being expected of me and what i expect of myself i start to feel much stressed,3
im still feeling positive and my actions reflect this,1
i feel skeptical now,4
i feel insulted because this person makes it appear that i haven t fully researched my material,3
i pushed on i did feel one rather unpleasant sensation sunburn,0
i feel that many people are a little confused about this fashion style,4
i cant stop the joyful tears from flowing as i feel this sweet baby moving,1
i find something in my life to lift me up and make me feel as wonderful as my boy once did,1
im concerned if i have wracked up lots of consecutive reds or am starting to feel agitated or frustrated at missing opportunities i know myself well enough to understand that i might need to take action before i lose control,3
im starting to feel like im unwelcome,0
i feel like i really need a sweet escape from la,1
i woke up feeling pretty listless and it hasnt really gone away,0
im being a teenager people and if you feel the need to make sarcastic bitchy comments you can kindly fuck off,3
i feel so disillusioned there is so much bitterness inside me right now,0
i like the feeling of popping zits especially the stubborn ones,3
i feel jealous for the person i raised my head to see my enemy omg she is so beautiful,3
i turned to old friends but wound up feeling ignored,0
i dont know how to pray as a muslim and since i dont feel like i would be sincere about praying to god i will meditate instead,1
i would ever be able to feel happy in a relationship once the proverbial or literal honeymoon ended,1
i am at choice to hold onto to the thoughts the feelings the sensations of having them be they pleasant or not,1
i feel about korea and my parents but i have somewhat accepted my fate on those issues and i can go about my life without being at least constantly broken up about it,2
i feel like if i complain i can become the bitchy one,3
i told the coaches today coming out here and i absolutely mean it i feel more appreciative for the opportunity than i feel deserving banks said,1
i look at me and feel inadequate,0
im feeling insecure and i really dont know what to do about this situation aside from ending the relationship,4
i feel so unimportant when im with you,0
im just feeling so shy with these photos lately so self conscious and fearful,4
i feel crappy because i dont handle the stupid time change well,0
i acknowledge that my addiction was not only about getting high on my own body chemistry but also to feel valued and desired and get attention i thought i couldnt get any other way,1
i used to feel really angry about having it but i don t feel angry about it anymore,3
i am feeling rather dangerous after all,3
i feel like i exhausted all alone amp too stressed out,0
i discovered my case of drill bits is missing which made me feel furious,3
i feel shitty thats all and when theres sadness it doesnt get resolved just builds up and never stops getting worse,0
i would like to pay so i am feeling a bit uncomfortable,4
i am definitely not against people having children i know i would feel incredibly selfish bringing another child in the the world when i know i could love one who is already here and needs me,3
i am feeling offended here,3
i do feel awful lazy doing it,0
i feel ignored and unimportant,0
i feel i should feel is amazing,5
i feel so carefree about work ive been careless,1
i feel kinda homesick right now because i feel like some of my friends dont care about me anymore,0
i get the feeling that with an appreciative audience she would absolutely fly but she made what i considered to be a mistake by identifying members of the audience who were just staring at her and somewhat alienating them by alluding to their aloofness,1
i feel a little intimidated but i havent given up on this idea completely yet,4
i think although the free time i have is too short due to shifts in a busy warehouse i am feeling quite positive that i can reach the deadline for this a kb version of this game project,1
i feel peaceful and calm when i dont have to think about other people but that isnt how the world works,1
im imagining my little boy so philosophical because i realize how much i cry and smile since i joined flickr and shared feeling with other people and their beloved cats,2
