text,label
i cry as i feel a weird pinching sensation deep inside me as he rips through my virginity but to be fair to this girl she s good at sucking since she has no gag reflex and is capable of giving a earthshaking blowjob on her first try,4
i often wonder how many of us out there enjoy massages as much as yours truly but always for some reasons walk away from one feeling dissatisfied,3
i have a lot of trouble concentrating and i generally feel less intelligent as silly as that might sound,1
i feel completely fine,1
i discover blogging only helps to accelerate my ill humour dilute my euphoria all in all causing myself to feel rather dull and bored as an after effect instead of the opposite,0
im lucky to have a husband who is so supportive and is able to deal with my moments of grief without making me feel ashamed or guilty,0
i was not prepared for feeling pissed something had taken me by suprise and though i knew it would pass i found myself impatient and more mad that it was happening right before i was heading in to teach,3
i was so touched and i still think of that every time i start feeling defeated,0
i feel pathetically stupid src http celebteenlaundry,0
i would but sometimes i feel like i have to be productive,1
im feeling rather melancholy today and lately,0
i feel really lucky to have found you as a resource and have always felt the answers i needed were there for the asking,1
i was driving i feel so contented after sadhana so fulfilled,1
i been so acquainted with sleep i feel like i should name it to ensure im not being rude or maybe it has a name already,3
i have a feeling that ugly love will be as good as heart wrenching as the others,0
i wanna give up i feel ignored in my new environment in my new house,0
i wasn t kidding i think i m really heading over to the bar where my boyfriend works to make fun of feel glad it s not me the drunkards,1
i am feeling hateful towards ummmm,3
i was obsessively checking my phone and getting on the cycle of thinking about why i was angry and why i was right to feel angry,3
i almost always awaken feeling terrific,1
i feel that my walk has been in vain,0
i will do anything that i feel laughs im pretty fearless when it comes to that stuff as people sort of got to look at this week,1
i get the feeling that everyone is going out of their ways to prove just how much suffering they all went through and who suffered more than so and so,0
i could turn to them but i feel like id be unwelcome,0
i feel privileged to now be the owner of one,1
i was days overdue and had been feeling highly irritated and uncomfortable for months,3
i can tell my blog readers who may be feeling the loss of a parent or loved one,2
i type this and i can hear the drops hitting the metal roof also something that always brought joy to me but feels so mournful to hear it today,0
i know she doesnt mean anything by this and she is just expressing some of her preferences but i just couldnt help but feel unloved,0
i feel like im being punished but i dont know what i did,0
i am feeling like i am ruining the experiment by being too complacent and indisciplined at this stage,1
i sit with this job that has all the components of greatness and i feel as though i m being so ungrateful by saying i m discontent with it,0
ive been feeling very nostalgic about emers baby years,2
i can t even say how horrible i feel for those families that have been left devastated by this,0
i feel a bit dazed from the panadol i took but still feeling too unaccomplished to head to bed,5
i feel even more pathetic and its fucking killing me,0
i feel like ive learnt loads about how friendly i actually can be,1
i think i might feel intimidated by some creepy zombie scarecrows but it mostly feels kind of boring,4
im feeling violent today eh,3
i had on my plate without the stress of feeling completely overwhelmed,5
i feel like getting distracted away from studies,3
i feel like i have so many amazing friends and family in my life who made last sunday a day that i will never forget,5
i feel disillusioned now,0
i feel a target blank rel nofollow href http www,0
im not sure where the line will be drawn but im pretty sure mudi would help me out no matter what and its such a nice feeling to have someone supporting you like that in such a different place,2
i have been in my mm comfort zone for too long and i feel the need to get a bit more creative with my composition,1
im feeling a lot more optimistic about results this month,1
i always feel like theres an air of trepidation and sorrowful nervousness at times,0
i cannot stand being hot when i sleep i wake up feeling even more exhausted,0
i just downloaded makes me feel a bit pained,0
i am feeling quite nostalgic especially when thinking about friends who are like families whom we left behind,2
i hate everything because i feel inadequate all the time but as soon as i have it i hate myself because i dont deserve it,0
i almost never feel deprived anymore nor do i have to force myelf to stick to any certain diet because i have learned to feel great about what i eat,0
i was reminded that feeling jealous is a sign that i am not feeling worthy and i am not connected to self source love,3
im feeling virtuous today as i dug out the brompton and cycled from the station to work,1
i see you and can t help feel shy,4
i always get ignored and this make me feel very mad,3
i feel intimidated and theres nowhere to park,4
i will be someone great becos i feel so shitty everyday living in this awful body and brain today was definitely a fuck up day a href https lh,0
i feel was a smart choice especially for an emerging pinball manufacturer,1
i feel so blessed and happy the children are just adorable and healthy,2
i feel like were supporting a small banana farm,1
im happy i can feel ecstatic absolutly beaming with joy,1
i wanted to feel sorry about my stomach pain and the disability to do my work out or keep a clean diet,0
i looked through all these things looked at old photos and re read old fanzines i started to feel incredibly nostalgic and i normally dislike nostalgia,2
i was feeling really weepy over the duration of everything,0
i could feel the gloomy london fog and the oppressive tropical heat even though i was on vacation in oregon,0
i really like it i feel so vain oh well lol this feels like one big comment sorry i just hope you like this too thanks,0
i feel like i need the hair of the dog when i saw the headline johnny bairstow in england team i wasnt impressed,5
i feel absolutely elegant in my white coat and now i have a cheaper version that i m not as worried about getting dirty,1
i am feeling so ridiculously uncomfortable these days the rising temperatures dont help and i have added wicked heartburn to the list of things keeping me up at night,4
i get from others that makes them feel burdened is their time,0
i had just gotten out of a relationship at that point and i was still feeling a little sad,0
i had gotten over my feelings and it was time to move on and so i convinced myself of this and felt a little bit better and i had a couple of dreams and then they stopped,1
i hope you enjoy my posts and feel free to contact me,1
im hopefully on the right track im hearing again and feeling well enough to throw together thanksgiving dinner for four,1
i progress reducing to order what my past life suggests and the more i persist in the rigor of composition of the chapters of the sentences of the book itself the more do i feel myself hardening in my will to utilize for virtuous ends my former hardships,1
i feel as though hermione is just as brave as katniss maybe even braver,1
i feel like im having a passionate affair with a man who everyone says is bad for me,2
i am feeling a little unsuccessful,0
i speak of grief as a whole separate being that is indeed how it feels like its own entity that is just always with me a most unwelcome presence everywhere i go even in my sleep,0
i feel insecure every day of my life but thats become just a part of my daily life now thats nothing new,4
ive worked really hard all year to try to make each child in the class feel like they are valued,1
im going to take some time and just really figure out why i feel so fucked up about what should be an innocent email and go from there i guess,3
i was not feeling that brave and was well wrapped up,1
i decided i was going to stop feeling ungrateful and sorry,0
i can give a person in the walmart parking lot a dollar sometimes small price to pay to escape the bad feeling of not being generous,1
i beaunesse dolly bird is back in work and i m delighted to say she s feeling keen to get on,1
i had my classification review they could not allow for me to compete in a wheelchair as there is certain rules they have to follow so my dream of feeling like running in a race wont happen in competition form but i am sure i can find another way to feel as though i am running again,1
i feel the exuberance of children and laugh as they say or do something cute or funny,1
i have just crawled reluctantly out of sleep but everything feeling as empty as before,0
i feel like i would be unkind if i did not give you a heads up about a giveaway that is going to be held here on friday october th,3
i feel like a beaten woman,0
i feel kinda strange,4
i feel definately perverse for being sexually frustrated at home where there is definately no appropriate outlet and i feel weird just for feeling like this,0
i feel selfish for my own feelings when i think of how foolish my struggle with contentment is,3
i still feel a bit unwelcome,0
i feel very confident in the defensive coaches,1
i have returned to it often when i feel confused or in the dark as to god s will on a matter,4
i feel the most dangerous of the groups were the people i have termed the minimizers,3
i feel like i need to put a weight on top of his sweet little head to stop him from growing up too fast,1
i cry because i feel i am unimportant to my family,0
im saying is that i fear they may feel hostile towards me and my culture and to those who do,3
i cannot change a situation so that i feel more valued i will leave the situation,1
i feel unwelcome and well,0
i play at top volume when i feel enraged or frustrated or just plain ole pissed off,3
i feel very clever and tricky,1
i still feel like that weird girl from middle school that will smoke and drink to impress people who she does not even like,5
i feel awful because we got into it while she was in the other room about if we should even be together,0
i always feel victimized indirectly,0
i had read all the books but i began to feel that the story was letting go some of the vital parts that the first fallen book promised,1
i guess i should stop myself the next time i feel myself getting angry over a perceived injustice huh,3
i feel burdened to speak out against mistruths about my god,0
i feel like this is more important,1
i feel that the authors are like caring teachers and friends,2
i walked with this lady in red the other night i could feel the cool soft snow beneath my feet,1
i feel we got a performance that was really faithful to a bear that could speak rather than a bear that speaks like a human,1
i feel terrified and angry and completely bewildered,4
i know the things that make me feel radiant and the things that do not,1
i feel very comfortable having this dialogue with you,1
i remember feeling very satisfied that all i had to do was associate the null value with the repayment date for dead as the referral reason to have everything work perfectly well,1
i heard madeleine mccann s mother say after she read my post mentioning david beckham and why he gave her the money say she feels disgusted in taking the money from david beckham and she wonders if his children are worth million each,3
i have no idea if my carpet is a wool or synthetic blend but im feeling brave and have nothing to lose im throwing caution to the wind im entering uncharted territories and have begun developing my own technique instead,1
i still remember feeling guilty,0
i didn t write down the name and description from the last time i stand there sweating and feeling overwhelmed with s of them before me,4
i have been told enough facts about their lives that i feel i can add them into the story before getting to the tragic ending,0
i won t bore you with the details of the training only to really say that i met some lovely people had a great time learnt how to plan lessons and returned feeling reassured that i had a support network of englaender in the vicinity,1
i wanna tell her how i feel but dont wanna fuck up like i did with the last one by being too keen,1
i remember feeling this lonely was about years ago,0
i feel safe is in the girls area because i can play with my sister emma,1
i feel like you are more into self promotion than truly caring about the greater good,2
i go back to orit feeling triumphant ish with all my papers the form the picture the receipt from the post office the letter from the hebrew lady,1
i guess it was nice to see that i could talk to a gm of a guild who was h in soo and not feel like i was petrified they thought i was an absolute noob,4
i want to love the crafts council as a maker they should be my central point of reference something i feel loyal to and want to help,2
i mean the moment or feeling or sight of you being affectionate,2
i hate that feeling in the moment afterwards im always glad for it,1
i left her office feeling very excited,1
i feel like we got our money s worth and that all the effort to avert the princess tragedy was not in vain,0
i simply just feel pressured today,4
i may feel depressed and low and as if he s going to walk away from me forever at any second,0
i feel like its safe space to help me be accountable and record how im really feeling,1
i feel frightened of playing i imagine charlie at the mic putting me on the spot,4
i know what it feels like to have gawking curious eyes trained upon me during a moment of crisis,5
i felt it had a slight bitterness in the finish that detracted from its oily mouthfeel and sweet entry,2
i feel most of my writing fits this description because i enjoy looking at the strange and unusual things in life,5
i read edwidges account of her uncle s last days with tear stung horror at the rough unfeeling treatment of this innocent deeply feeling man,1
i am someone they never have to compete with because they know that they can share their success with me and i wont feel threatened,4
i feel so aggravated right now i could tear someones throat out,3
i have been feeling so fantastic lately that i am back to searching for new music to inspire me,1
i feel apprehensive and guilty about even saying his name sometimes as if ill depress everyone else,4
i want to keep things simple but beautiful and i want to feel relaxed when i enter my home,1
i feel like ive been beaten around a bit,0
i have been working on my senior project a lot because it gives me time to stop and focus on one thing that makes me feel like i am accomplishing something productive,1
i posted such a thing and you can tell me not to feel paranoid,4
i now know that exact feeling as i was totally intimidated by the burly men flexing in front of the mirrors,4
i have a nagging feeling that this is probably the most useless blog post i have ever written and i am now making this face a href http,0
i would like to have air conditioned classrooom or more fans so that we will feel cooler and distressed during any period of time in school,4
i feel like i m being slowly tortured to death but i have been promised that it will eventually get easier and not hurt so bad,4
im feeling really lame lately that i dont have anything to give away to you,0
i was going to read it at the bar tonight but in the interest of feeling less alone in this endeavor i think i am going to wait until i get home and then record myself reading it,0
i feel like being creative and crafty,1
i feel so clever when i intentionally wear my my chemical romance black parade t shirt to work on dissecting days,1
i just wanted to let you know that i wore a dress and cowboy boots to the airport when i went home to utah and if i didnt feel like a proud texan at that point then i never will,1
i still think and feel that it is stupid and uncalled for,0
i was feeling pleased with myself because i was wearing high heeled shoes and not falling over,1
i was on a mission and unwilling to go with it feels like hot apple pie,2
i feel confused a lot of the time,4
i have been feeling a little discouraged with the process so i felt the need to just pray,0
i burst in as room totally without knocking on the door as i usually do and i was feeling frantic at not being able to see,4
i sometimes feel all nostalgic and feel the need to go back and look at some of my old blog posts and all i can say is that without knowing it they record and hold so many memories,2
i feel rejuvenate and peaceful closer to what life should be simple soft and human,1
im feeling so lonely and miserable now,0
i do look beautiful without make up and when i m wearing glasses i feel myself so so so ugly,0
i get a line of colours moving through my eyes and it feels like ive switched on the tv on an empty channel,0
i feel overwhelmed with current events,5
i would feel uncomfortable with the gold paneling,4
i feel like an ungrateful little b,0
i feel remotely idiotic at the moment and i dont know why,0
i feel a little melancholy especially when i think i might have been a bit more receptive to possible opportunities,0
when the paramilitary was sent to the unza and it started using tear gas and started intimidating the students without any provocation,3
i wait to hear if you feel i should find this is acceptable,1
i hear them call each other brother and i feel all melty and weepy and i wish everyone could see the instant replay in my head,0
i feel so lost inside,0
i was grateful for but must admit didn t give huge amounts of thought to despite always feeling sympathetic for women who experience difficulty,2
im feeling a tad discontent,0
i get myself so upset about educational inequity that i feel entirely helpless and about to lose my shit,4
im starting to not buy the whole everything happens for a reason bit or god has a plan b c i feel that god is love and theres no way that he would torture me and other women like weve been tortured dealing w fertility issues,3
i hold on to the feeling i dont know when i will feel it again ive become amused by the little things seconds of pleasure and finally,1
i feel like i m talking to my husband s needy little sister who wants to do whatever she wants just don t be mad at her,0
i feel quite honoured and humbled that people from various parts of the world are allowing me into their lives and their homes as it were and my hope is that in some small way my words might be an encouragement to them,1
i havent tested this out with many different outfits but for someone who tends to live in monochrome i feel like this is a perfect pop of colour and something different rather than just reds or pinks,1
i feel like it was still really useful,1
im feeling generous actually giddy with relief that my daughters okay,2
i watched the boys i used to be friends with took a picture with gretel that made me feel cool and danced and sang like everyone didnt think i was dumb,1
i sought solace reminding me i have worth i spent the rest of the workday feeling worthless,0
i feel your tender lips against mine,2
i managed to sit and tell all the things i was feeling and have felt for quite a long time now scared and unhappy,4
i feel like it here are ten of the many sites that keep me entertained on a daily basis,1
i feel fearful of trying because i know i don t have the willpower that i would need to get through it,4
i punched out for the day i began to feel strange again,4
i truly am if you feel offended or if you are the one who got hurt,3
i began feeling lethargic crampy and waking up with massive headaches the hangover with out the booze,0
i guess what im trying to say is if you feel like you need oz of coffee try sleeping because youre going to be fucked all day anyway even with a synthetic kick to get your ass into gear,3
i wake up feeling contented much like the luckiest girl in the world and then he surprises me even more with the kind of attention and care he gives me,1
i think the same is true for buffy she feels burdened and sometimes wishes she didn t have to be responsible for well the world,0
i brought them to a wrong place so i feel very embarrassed,0
i hate feeling broke,0
ive lost a good inches so im feeling a bit stunned,5
ive been feeling so insecure lately not about myself but about how i speak english,4
i want them to want to live with me not feel tortured in living with me,3
i love my dark angels as they are my first army but this left me feeling slightly jaded,0
i feel like selfish and incomplete,3
i feel as though i cannot get mad at anyone though because if it wasnt for reading ronans blog i would have no idea either,3
i am feeling sentimental for the good ol days,0
i feel like im never going to find my prince charming,1
i still feel oddly unsure about his latest novel the marriage plot,4
i learned about different things like how family plan the arrangements and even how real the pain can feel when a loved one passes on,2
i hope that the potus is able to move the country forward in a way that leaves our children feeling proud and believing in the political process,1
i was feeling really brave and i just kept telling everyone yeah okay well were just going to keep knocking so have a nice day,1
i think the website page made me feel so awful b c it rang true,0
i could make jokes and take a bit more openly than i can with someone from here i feel like i can communicate well but it is super hard to translate jokes or just random things we say in english haha,1
i need to feel like im accepted and that i matter and that im loved,1
i feel really proud of myself for not compromising the value i place on myself and my time,1
i think underneath it all i feel helpless and unsure of how to handle everything,0
i want desperately to reach my goal weight and finally feel hot and sexy again but then reality hits and i focus on the loose skin saggy stomach and boobs cellulite and wrinkles,2
i can stop looking over my shoulder feeling paranoid that she constantly stalk me,4
i was feeling really unsure about things i was lonely and i had no friends to hang out with besides my friend from high school who i still kept in contact with,4
i have just got back from days away in london and im feeling very festive so just thought i would put together a post of some christmassy photos i took whilst there,1
i am now feeling quite festive,1
i think that this song really gives you a feel for how dangerous and changed the world has become especially after dark,3
i keep bars on hand and break off a square or two a few times each week not too often but enough so that i don t feel deprived because feeling deprived is not healthy,0
i only had to take one break during the wod because i was feeling some weird pulling tightness in my lower abdomen and i made sure to keep my heartrate in check,5
i feel as if we are a pair of naughty school girls,2
i am feeling pretty grouchy today,3
i could feel impatient rustling behind me,3
ive been a little slacking in the pregnancy posts and pictures because even though itll be fun to look back on one day they feel incredibly vain,0
i wake up feeling better,1
i totally understand this and feel a bit stupid since i never even thought about it before,0
i was feeling peaceful and content on the bus i was thinking about how tonight my new friends in valpo will be celebrating dancing and drinking laughing and talking and i will not be there with them,1
i feel annoyed at daily chores like brushing my teeth or tidying up the kitchen but those diapers full of stinky stuff,3
i can drift in the wind like i can put on ballet slippers ice skates and dance skate for as long as i feel listening to songs with words can relate to a situation you have been through or bring back a memory of a funny time,5
i do feel a little hesitant,4
im feeling good so far,1
i had to say no to another day of rushing around and feeling frustrated,3
i don t have to make others feel bad to make myself feel good,0
i feel so stupid for making that assumption about her,0
i feel like this is such a whiney entry,0
i didn t intentionally set out for that to be my mission in life but it feels amazing to think that i have inspired others,5
im half sick to my stomach feeling bitter and sorry for myself,3
i feel like all the people here and not to be elitist or bitchy or anything are really immature and really annoying,3
i feel so doomed and alone,0
i feel very unloved by us customs,0
i feel even a little bit threatened,4
i feel very unhappy and incomplete,0
i want to be with someone who makes me feel that they like me i dont want to have something else to be neurotic about fuck,4
i know i want to honor god and stay true to what i feel i believe in but i feel myself so unsure,4
i feel watching you entertained by the earned predictability of your smallest habits and inadvertant expressions,1
i think people should gradually expand their social boundaries and for example receive help from a black man and not feel threatened by a puerto rican at night on a street,4
i came back to hamilton with sandra nonna and alissa for one final sleep in my room and because i have a dentist appointment in the morning and its just easier to be here haha its a strange feeling being here because its so empty and really doesnt resemble how em and i had it up here at all,0
i have gained lbs since giving up running i feel quite content with my body and self image,1
i was so excited about the next stage whereas now i feel how precious and irreplaceable each moment is knowing how quickly each stage passes i have no desire to rush any of it,1
